company,comment,cleaned_comment,score,time
USPS,Bid a business route. Saturdays will no longer be heavy.,bid a business route saturdays will no longer be heavy,4,2026-02-14 19:58:37+00:00
USPS,Cause Saturdays be Saturdaying,cause saturdays be saturdaying,1,2026-02-14 19:59:36+00:00
USPS,Ground and Parcel select usually takes 4-6 days to ship. Sunday is the off day aka shopping day for most people. Which day next week would the package get to you if customers order on Sunday and takes 6 days to ship?,ground and parcel select usually takes 46 days to ship sunday is the off day aka shopping day for most people which day next week would the package get to you if customers order on sunday and takes 6 days to ship,1,2026-02-14 20:04:57+00:00
USPS,"Middle management slice missing. No reason why you'd need to go up the chain of 4-5 ""managerial"" positions to talk to DM. ",middle management slice missing no reason why youd need to go up the chain of 45 managerial positions to talk to dm,4,2026-02-14 19:49:29+00:00
USPS,"DMs would quite literally never get anything done as they would have to be processing leave requests and shuffling around potentially hundreds of postmasters leave around…MPOOs suck and get paid too much, but the answer woudlnt be to have the DM take over those duties especially if your goal is to talk to the DM",dms would quite literally never get anything done as they would have to be processing leave requests and shuffling around potentially hundreds of postmasters leave aroundmpoos suck and get paid too much but the answer woudlnt be to have the dm take over those duties especially if your goal is to talk to the dm,1,2026-02-14 19:58:58+00:00
